{
  "$schema": "level.schema.json",
  "name": "Crumbling Path",
  "description": "These platforms crumble soon after you land on them. Keep moving, or wait for them to grow back.",
  "spawn": { "x": 40, "y": "groundY-100" },
  "areas": [
    {
      "name": "main",
      "platforms": [
        { "x": -50, "y": "groundY", "length": "groundLength" },
        { "x": 250, "y": "groundY-150", "length": 200 },
        { "x": 550, "y": "groundY-250", "length": 160, "crumbling": true },
        { "x": 850, "y": "groundY-350", "length": 160, "crumbling": true },
        { "x": 1150, "y": "groundY-450", "length": 160, "crumbling": true },
        { "x": 1450, "y": "groundY-550", "length": 250 },
        { "x": 1150, "y": "groundY-700", "length": 160, "crumbling": true },
        { "x": 850, "y": "groundY-820", "length": 160, "crumbling": true },
        { "x": 550, "y": "groundY-940", "length": 160, "crumbling": true },
        { "x": 200, "y": "groundY-1060", "length": 250 }
      ],
      "doors": [
        { "x": 240, "y": "groundY-1195" }
      ],
      "powerUps": [
        { "x": 1560, "y": "groundY-640", "type": "health" }
      ]
    }
  ]
}
