{
  "$schema": "level.schema.json",
  "name": "The Key",
  "description": "The exit is locked. Climb up and back to the key at the top, then bring it down to the door.",
  "medals": { "gold": 30, "silver": 50, "bronze": 75 },
  "spawn": { "x": 40, "y": "groundY-100" },
  "areas": [
    {
      "name": "main",
      "platforms": [
        { "x": -50, "y": "groundY", "length": "groundLength" },
        { "x": 250, "y": "groundY-150", "length": 200 },
        { "x": 600, "y": "groundY-300", "length": 200, "monster": true },
        { "x": 950, "y": "groundY-450", "length": 400 },
        { "x": 1450, "y": "groundY-600", "length": 300, "monster": true },
        { "x": 1100, "y": "groundY-750", "length": 150 },
        { "x": 680, "y": "groundY-900", "length": 200, "crumbling": true },
        { "x": 250, "y": "groundY-1050", "length": 200 }
      ],
      "doors": [
        { "x": 1650, "y": "groundY-135", "locked": true }
      ],
      "keys": [
        { "x": 310, "y": "groundY-1170" }
      ],
      "powerUps": [
        { "x": 1000, "y": "groundY-540", "type": "health" }
      ],
      "npcs": [
        {
          "x": 1450,
          "y": "groundY-250",
          "name": "Pip",
          "lines": [
            "This door is locked. The key is right at the top - you'll have to climb for it.",
            "Keys go into your inventory. Pick the key's slot with 1, 2 or 3, then press {use} at the door."
          ]
        }
      ],
      "gems": [
        { "x": 1850, "y": "groundY-56" },
        { "x": 980, "y": "groundY-786" },
        { "x": 1160, "y": "groundY-1086" }
      ]
    }
  ]
}
