{
  "$schema": "level.schema.json",
  "name": "Frog Pond",
  "description": "Frogs guard the way up. Throw orbs at them, or time your jumps to slip past.",
  "medals": { "gold": 20, "silver": 30, "bronze": 50 },
  "spawn": { "x": 40, "y": "groundY-100" },
  "areas": [
    {
      "name": "main",
      "platforms": [
        { "x": -50, "y": "groundY", "length": "groundLength" },
        { "x": 300, "y": "groundY-140", "length": 300, "monster": true },
        { "x": 750, "y": "groundY-260", "length": 300, "monster": true },
        { "x": 1250, "y": "groundY-380", "length": 250 },
        { "x": 1600, "y": "groundY-520", "length": 300, "monster": true },
        { "x": 1250, "y": "groundY-740", "length": 200 },
        { "x": 800, "y": "groundY-860", "length": 250, "monster": true },
        { "x": 350, "y": "groundY-980", "length": 250 }
      ],
      "doors": [
        { "x": 390, "y": "groundY-1115" }
      ],
      "powerUps": [
        { "x": 1320, "y": "groundY-830", "type": "health" }
      ],
      "gems": [
        { "x": 1860, "y": "groundY-56" },
        { "x": 1500, "y": "groundY-676" },
        { "x": 270, "y": "groundY-1286" }
      ]
    }
  ]
}
