{
  "$schema": "level.schema.json",
  "name": "Sky Ferry",
  "description": "Platforms that glide back and forth. Wait for one to come to you, ride it, and jump off at the other end.",
  "medals": { "gold": 40, "silver": 65, "bronze": 100 },
  "spawn": { "x": 40, "y": "groundY-100" },
  "areas": [
    {
      "name": "main",
      "platforms": [
        { "x": -50, "y": "groundY", "length": "groundLength" },
        { "x": 250, "y": "groundY-250", "length": 200 },
        {
          "x": 550,
          "y": "groundY-450",
          "length": 160,
          "moveTo": { "x": 1150, "y": "groundY-450" },
          "moveTime": 3
        },
        { "x": 1350, "y": "groundY-450", "length": 200 },
        {
          "x": 1650,
          "y": "groundY-450",
          "length": 160,
          "moveTo": { "x": 1650, "y": "groundY-900" },
          "moveTime": 2.5
        },
        { "x": 1300, "y": "groundY-900", "length": 200 },
        {
          "x": 1100,
          "y": "groundY-900",
          "length": 160,
          "moveTo": { "x": 500, "y": "groundY-900" },
          "moveTime": 3.5
        },
        { "x": 150, "y": "groundY-950", "length": 250 }
      ],
      "doors": [
        { "x": 250, "y": "groundY-1085" }
      ],
      "ghosts": [
        { "x": 800, "y": "groundY-1050", "radius": 220 }
      ],
      "powerUps": [
        { "x": 1420, "y": "groundY-540", "type": "health" }
      ],
      "checkpoints": [
        { "x": 1320, "y": "groundY-1020" }
      ],
      "gems": [
        { "x": 1560, "y": "groundY-736" },
        { "x": 1860, "y": "groundY-56" },
        { "x": 200, "y": "groundY-1286" }
      ]
    }
  ]
}
